{
  "$schema": "http://json-schema.org/draft-07/schema#",
  "$id": "https://github.com/studiolxd/brand/native/parity/schema.json",
  "title": "Ficha de paridad de un componente",
  "description": "Una ficha por componente portado a nativo. `pnpm native:parity` la valida contra este esquema y contra el tipo de props del componente de React; las pruebas de SwiftUI y de Compose comprueban que el componente nativo expone exactamente los mismos casos. Ver native/parity/README.md.",
  "type": "object",
  "additionalProperties": false,
  "required": ["component", "react", "native", "props"],
  "properties": {
    "$schema": { "type": "string" },
    "component": {
      "description": "Nombre del componente en React (el export de su subruta del paquete). Es también el nombre de la ficha: `components/<component>.json`.",
      "type": "string",
      "pattern": "^[A-Z][A-Za-z0-9]*$"
    },
    "react": {
      "type": "object",
      "additionalProperties": false,
      "required": ["path", "props"],
      "properties": {
        "path": {
          "description": "Ruta, desde la raíz del repositorio, del `.tsx` que define las props.",
          "type": "string",
          "pattern": "^src/.+\\.tsx?$"
        },
        "props": {
          "description": "Nombre del tipo o interfaz exportado que describe las props (por ejemplo `ButtonProps`).",
          "type": "string",
          "pattern": "^[A-Z][A-Za-z0-9]*$"
        }
      }
    },
    "native": {
      "description": "Cómo se llama el componente en cada plataforma.",
      "type": "object",
      "additionalProperties": false,
      "required": ["swift", "kotlin"],
      "properties": {
        "swift": { "description": "Tipo público de SwiftUI. Si el componente se presenta con un modificador (`swiftModifier`), es la vista que ese modificador pinta.", "type": "string", "pattern": "^[A-Z][A-Za-z0-9]*$" },
        "swiftModifier": { "description": "Nombre del modificador de vista con el que se presenta en SwiftUI, sin el punto ni los argumentos: `brandSheet` para `.brandSheet(isPresented:…)`. Solo para lo que en SwiftUI se monta desde una vista ajena (hojas, diálogos, el host de toasts).", "type": "string", "pattern": "^[a-z][A-Za-z0-9]*$" },
        "kotlin": { "type": "string", "pattern": "^[A-Z][A-Za-z0-9]*$" }
      }
    },
    "props": {
      "description": "Las props de React que SÍ existen en nativo, con sus casos. Las demás props propias del componente van en `excluded`.",
      "type": "object",
      "propertyNames": { "pattern": "^[a-zA-Z][A-Za-z0-9]*$" },
      "additionalProperties": {
        "oneOf": [
          {
            "description": "Una unión de literales de texto (`variant`, `size`, `tone`…): los valores son EXACTAMENTE los de React.",
            "type": "object",
            "additionalProperties": false,
            "required": ["type", "values"],
            "properties": {
              "type": { "const": "union" },
              "values": {
                "type": "array",
                "minItems": 1,
                "uniqueItems": true,
                "items": { "type": "string", "minLength": 1 }
              },
              "default": { "description": "Valor por defecto, si lo hay. Informativo.", "type": "string" },
              "deprecatedValues": {
                "description": "Literales que React admite todavía SOLO como alias obsoleto de otro (`Paragraph size=\"small\"` → `sm`). Con `values` suman EXACTAMENTE los literales de React. En nativo no son casos del enum: son alias obsoletos (`@available(*, deprecated, renamed:)` en Swift, `@Deprecated(ReplaceWith(…))` en Kotlin), así que las pruebas nativas solo comparan `values`.",
                "type": "array",
                "minItems": 1,
                "uniqueItems": true,
                "items": { "type": "string", "minLength": 1 }
              }
            }
          },
          {
            "description": "Un booleano (`disabled`, `destructive`, `iconOnly`…): un estado que el componente nativo también expone.",
            "type": "object",
            "additionalProperties": false,
            "required": ["type"],
            "properties": {
              "type": { "const": "boolean" },
              "default": { "description": "Valor por defecto, si lo hay. Informativo.", "type": "boolean" },
              "reactOnlyValues": {
                "description": "Literales de texto que React admite además del booleano (`block: boolean | 'mobile'`) y que no existen en nativo. Han de ser EXACTAMENTE los de React.",
                "type": "array",
                "uniqueItems": true,
                "items": { "type": "string", "minLength": 1 }
              }
            }
          }
        ]
      }
    },
    "differences": {
      "description": "Diferencias que se quedan A PROPÓSITO respecto a la versión de React (límites de SwiftUI/Compose, convenciones de la plataforma), una frase cada una. Lo que no se pueda igualar se aproxima y se explica aquí.",
      "type": "array",
      "items": { "type": "string", "minLength": 10 }
    },
    "deprecated": {
      "description": "Props de React que solo son el alias obsoleto de otra (`Tag variant` → `tone`): llevan `@deprecated` en su JSDoc y se retiran en el major siguiente. No se registran en las pruebas nativas; en nativo existen como parámetro o inicializador obsoleto que remite a `replacement`.",
      "type": "array",
      "uniqueItems": true,
      "items": {
        "type": "object",
        "additionalProperties": false,
        "required": ["prop", "replacement"],
        "properties": {
          "prop": { "type": "string", "pattern": "^[a-zA-Z][A-Za-z0-9]*$" },
          "replacement": { "description": "La prop de `props` que la sustituye.", "type": "string", "pattern": "^[a-zA-Z][A-Za-z0-9]*$" }
        }
      }
    },
    "excluded": {
      "description": "Props propias del componente de React que NO se portan, cada una con su porqué.",
      "type": "array",
      "uniqueItems": true,
      "items": {
        "type": "object",
        "additionalProperties": false,
        "required": ["prop", "reason"],
        "properties": {
          "prop": { "type": "string", "pattern": "^[a-zA-Z][A-Za-z0-9]*$" },
          "reason": { "type": "string", "minLength": 10 }
        }
      }
    }
  }
}
