{
  "$schema": "../schema.json",
  "component": "Heading",
  "react": {
    "path": "src/stories/atoms/Heading/Heading.tsx",
    "props": "HeadingProps"
  },
  "native": {
    "swift": "BrandHeading",
    "kotlin": "BrandHeading"
  },
  "props": {
    "level": {
      "type": "union",
      "values": [
        "1",
        "2",
        "3",
        "4",
        "5",
        "6"
      ],
      "default": "2"
    },
    "size": {
      "type": "union",
      "values": [
        "1",
        "2",
        "3",
        "4",
        "5",
        "6",
        "7",
        "8",
        "9",
        "10"
      ]
    }
  },
  "excluded": [
    {
      "prop": "children",
      "reason": "En SwiftUI el contenido es el primer argumento del inicializador (`BrandHeading(\"Título\")`), no un hijo."
    }
  ],
  "differences": [
    "Una línea mide exactamente su caja de CSS (`tamaño × line-height`, con la tinta centrada como el medio interlineado de la web), en las dos plataformas. Con `line-height` por debajo del alto natural de la fuente (h1–h3 a 1,1; Google Sans Flex mide 1,25 em) SwiftUI no aprieta el paso entre líneas: un título de varias líneas mide (n − 1) × (alto natural − line-height) más que en la web (+6,1 pt por línea en un h1 de 40). Compose sí lo aprieta (`LineHeightStyle` Tight/Both).",
    "El texto de la web se ve algo más grueso (suavizado de Chromium en macOS); el peso del eje `wght` es el mismo.",
    "En Android `heading()` marca el encabezado para TalkBack pero no distingue niveles: el nivel solo fija el tamaño y el esquema lo conserva el desarrollador.",
    "En Android el eje de tamaño óptico (`opsz`) de la fuente se fija al tamaño del token, como hace el navegador; sin él los títulos salían más estrechos. El texto se ve algo más fino que en la web (Chromium engorda al suavizar)."
  ]
}
