{
  "$schema": "../schema.json",
  "component": "Toaster",
  "react": { "path": "src/stories/molecules/Toast/Toaster.tsx", "props": "ToasterProps" },
  "native": { "swift": "BrandToastCard", "swiftModifier": "toastHost", "kotlin": "ToastHost" },
  "props": {
    "position": { "type": "union", "values": ["bottom-right", "bottom-left", "bottom-center", "top-right", "top-left", "top-center"], "default": "bottom-right" },
    "closeButton": { "type": "boolean", "default": true },
    "expand": { "type": "boolean", "default": false }
  },
  "excluded": [
    { "prop": "containerAriaLabel", "reason": "Se porta como `containerLabel: LocalizedStringKey` («Notificaciones» por defecto); la ficha solo tipa uniones y booleanos." },
    { "prop": "closeLabel", "reason": "Se porta como `closeLabel: LocalizedStringKey` («Cerrar» por defecto); la ficha solo tipa uniones y booleanos." },
    { "prop": "duration", "reason": "Se porta como `duration: TimeInterval` en segundos (5); la ficha solo tipa uniones y booleanos." },
    { "prop": "gap", "reason": "Se porta como `gap: CGFloat` (`toast.gap`, 8 pt); la ficha solo tipa uniones y booleanos." },
    { "prop": "visibleToasts", "reason": "Se porta como `visibleToasts: Int` (3); la ficha solo tipa uniones y booleanos." }
  ],
  "differences": [
    "SwiftUI: la pila se monta con el modificador `.toastHost(…)` sobre la raíz (el `<Toaster />` de React), que pinta encima `ToastStack` —un tipo interno, no público— con un `BrandToastCard` por aviso; `ToastHost` solo existe en Compose. La ficha nombra el modificador en `swiftModifier` y, como tipo, la tarjeta pública `BrandToastCard`.",
    "El anuncio a VoiceOver usa `AccessibilityNotification.Announcement` con prioridad alta para `error` y `warning` y baja para el resto, en vez de `role=\"alertdialog\"`/`status`.",
    "La pila se despliega con el puntero encima (macOS, iPad); en iPhone táctil queda recogida salvo `expand: true`.",
    "El gesto de descarte (deslizar) usa los 40 pt de umbral por defecto de Base UI, que no es un token.",
    "El reloj se detiene mientras el puntero o el dedo están sobre la pila, como el foco/puntero de la web.",
    "Un aviso `loading` no pinta indicador de espera propio: igual que en React, la intención solo cambia el comportamiento (no se cierra solo).",
    "Android: el anuncio a TalkBack es una región viva (`liveRegion`) sobre el título y la descripción de cada aviso, asertiva para `error` y `warning` y cortés para el resto (también al actualizarlo por su `id`), en vez de `AccessibilityNotification.Announcement`. Descartar es además la acción `dismiss` de la semántica.",
    "Android: la pila se despliega con el puntero (ratón, lápiz, ChromeOS) encima o con `expand: true`; el dedo solo detiene el reloj mientras toca. `duration` es `kotlin.time.Duration` y `gap` es `Dp`.",
    "Android: entrada, salida y recolocación se saltan si el usuario quitó las animaciones del sistema (escala de animación 0)."
  ]
}
