{
  "$schema": "../schema.json",
  "component": "List",
  "react": { "path": "src/stories/atoms/List/List.tsx", "props": "ListProps" },
  "native": { "swift": "BrandList", "kotlin": "BrandList" },
  "props": {
    "type": { "type": "union", "values": ["unordered", "ordered", "plain"], "default": "unordered" }
  },
  "excluded": [
    { "prop": "children", "reason": "En SwiftUI los ítems son el contenido del `@ViewBuilder` de `BrandList`, no una prop." }
  ],
  "differences": [
    "Solo nativo: `showsSeparators` dibuja la línea de `separator.*` entre filas (la fila de ajustes que Homenize llama `ListRow`); en React la lista no lleva separadores.",
    "Las marcas (• y 1.) son texto en la sangría de `text.list.padding-inline-start`, alineado a la derecha como el marcador `outside` del navegador; el glifo del disco lo decide la fuente, no `list-style-type: disc`.",
    "La numeración se calcula con `_VariadicView` (SwiftUI público pero con guion bajo) porque `Group(subviews:)` exige iOS 18 y el paquete llega a iOS 17.",
    "Una lista anidada suma `text.list.padding-inline-start` por nivel, igual que en la web."
  ]
}
