{
  "$schema": "../schema.json",
  "component": "Paragraph",
  "react": {
    "path": "src/stories/atoms/Paragraph/Paragraph.tsx",
    "props": "ParagraphProps"
  },
  "native": {
    "swift": "BrandParagraph",
    "kotlin": "BrandParagraph"
  },
  "props": {
    "size": {
      "type": "union",
      "values": [
        "sm",
        "md",
        "lg"
      ],
      "default": "md"
    }
  },
  "excluded": [
    {
      "prop": "children",
      "reason": "En SwiftUI el contenido es el primer argumento del inicializador (`BrandParagraph(\"Texto\")`), no un hijo."
    }
  ],
  "differences": [
    "El texto de la web se ve algo más grueso (suavizado de Chromium en macOS); el peso del eje `wght` es el mismo.",
    "En Compose, un párrafo con fragmentos marcados recibe un `AnnotatedString` hecho con `brandSpanStyle` (en SwiftUI, un `Text` concatenado con `Text.brand`).",
    "En Android el eje de tamaño óptico (`opsz`) de la fuente se fija al tamaño del token, como hace el navegador."
  ]
}
