{
  "$schema": "../schema.json",
  "component": "ListItem",
  "react": {
    "path": "src/stories/atoms/List/List.tsx",
    "props": "ListItemProps"
  },
  "native": {
    "swift": "BrandListItem",
    "kotlin": "BrandListItem"
  },
  "props": {},
  "excluded": [
    {
      "prop": "as",
      "reason": "Cambia el elemento HTML (`div role=listitem`); en SwiftUI no hay elementos: el rol lo da el contenedor `BrandList`."
    },
    {
      "prop": "children",
      "reason": "En SwiftUI el contenido es el `@ViewBuilder content` del inicializador, no una prop."
    },
    {
      "prop": "leading",
      "reason": "Es un nodo de React; en SwiftUI es el cierre `@ViewBuilder leading` del inicializador y en Compose el parámetro `leading`."
    },
    {
      "prop": "secondary",
      "reason": "Es un nodo de React; en SwiftUI es el cierre `@ViewBuilder secondary` (o el `subtitle` de texto del inicializador de conveniencia)."
    },
    {
      "prop": "trailing",
      "reason": "Es un nodo de React; en SwiftUI es el cierre `@ViewBuilder trailing` del inicializador."
    }
  ],
  "differences": [
    "`leading`, `secondary` y `trailing` existen en las tres plataformas. En React el envoltorio de fila (`list__item-row`) solo aparece cuando se usa alguno; en SwiftUI y Compose el ítem es siempre una fila.",
    "`onClick` (fila entera pulsable) es la forma nativa de una fila que se pulsa; en React es un botón o un enlace dentro del ítem (`as` solo cambia la etiqueta, `li` o `div`). Existe en SwiftUI (`BrandListItem(action:)`) y en Compose (`onClick`), con la misma semántica: la fila entera es el objetivo, con estado pulsado y rasgo de botón (VoiceOver) o rol de botón (TalkBack). No es una prop de React y por eso no está en `props` ni en `excluded`."
  ]
}
