{
  "$schema": "../schema.json",
  "component": "Toast",
  "react": {
    "path": "src/stories/molecules/Toast/toast.ts",
    "props": "ToastOptions"
  },
  "native": {
    "swift": "ToastCenter",
    "kotlin": "ToastCenter"
  },
  "props": {},
  "excluded": [
    {
      "prop": "id",
      "reason": "Se porta como el argumento `id: String?` de `ToastCenter.show(…)` y compañía; la ficha solo tipa uniones y booleanos."
    },
    {
      "prop": "description",
      "reason": "Se porta como `description: String?`; en nativo es texto plano, no un nodo de React."
    },
    {
      "prop": "duration",
      "reason": "Se porta como `duration: TimeInterval?` en segundos (`.infinity` lo deja fijo), no en milisegundos."
    },
    {
      "prop": "action",
      "reason": "Se porta como `action: ToastAction?` (rótulo + cierre); la ficha solo tipa uniones y booleanos."
    },
    {
      "prop": "onClose",
      "reason": "Se porta como el cierre `onClose` de `ToastCenter.show(…)`; la ficha solo tipa uniones y booleanos."
    }
  ],
  "differences": [
    "`ToastIntent` (default, success, error, warning, info, loading) es un enum con los mismos casos y `rawValue` que el tipo de React; lo vigila `OverlaysLogicTests` porque la ficha no tipa uniones fuera de las props.",
    "La API es la clase observable `ToastCenter` (`ToastCenter.shared.success(…)`), no el objeto `toast` de React; `toast.promise` es `ToastCenter.promise(loading:success:error:_:)` con una tarea `async`.",
    "El título es `String`: quien llama lo localiza, igual que en React no hay textos propios por defecto.",
    "A la misma escala el aviso coincide con la web en caja, rellenos, borde, interlineado y tracking: el borde ocupa sitio por fuera del relleno (`box-sizing: border-box`), el aspa queda a `alert.close-inset` del borde interior, el título mide una caja de 16 × 1,3 = 20,8 con el −0,02 em de `toast.title-letter-spacing` (el de un `<h2>`, `text.h2-letter-spacing`), cada línea de la descripción 16 × 1,5 = 24 y la acción va a `alert.content-gap` del texto. Un aviso de solo título mide 54,8, con descripción de dos líneas 110,8 y con acción 94,8, como en la web (en Compose, con el redondeo de abajo).",
    "El peso es el mismo en las tres plataformas (`wght` 500 en el título y 300 en la descripción, con `opsz` 16): en las parejas la web se ve algo más gruesa porque Chromium en macOS engorda el trazo al suavizar, sobre todo con tinta clara sobre un relleno oscuro; con `-webkit-font-smoothing: antialiased` pinta igual que el nativo. No se compensa subiendo el peso en nativo.",
    "Android: Compose redondea el interlineado al píxel por arriba (20,8 → 21 dp), así que el aviso mide 0,2 dp más que en la web (55 dp el de solo título). SwiftUI mide la caja exacta.",
    "Android: `duration` es `kotlin.time.Duration` (`Duration.INFINITE` lo deja fijo), no segundos; `ToastCenter.shared` es la cola global y `ToastCenter()` crea una propia para pasársela a `ToastHost(center = …)`. `update(id, …)` actualiza un aviso vivo sin crear otro, y `promise` es `suspend` y cierra el aviso si la corrutina se cancela.",
    "Android: la cola es estado de Compose (`items`); los relojes de cierre los lleva `ToastHost`, así que sin host montado los avisos no caducan."
  ]
}
