{
  "$schema": "../schema.json",
  "component": "PasswordField",
  "react": { "path": "src/stories/molecules/PasswordField/PasswordField.tsx", "props": "PasswordFieldProps" },
  "native": { "swift": "BrandPasswordField", "kotlin": "BrandPasswordField" },
  "props": {
    "size": { "type": "union", "values": ["sm", "md", "lg"], "default": "md" },
    "labelHidden": { "type": "boolean", "default": false },
    "optional": { "type": "boolean", "default": false },
    "error": { "type": "boolean", "default": false }
  },
  "excluded": [
    { "prop": "optionalLabel", "reason": "No es una unión ni un booleano: es el texto de la marca, un parámetro `optionalLabel` con el castellano «(opcional)» por defecto (como `requiredLabel`), que solo se pinta con `optional`." },
    { "prop": "label", "reason": "No es una unión ni un booleano: es el primer argumento del inicializador (`BrandPasswordField(\"Contraseña\", text: …)`); como en React, la etiqueta se ve por defecto y `labelHidden: true` la oculta a la vista." },
    { "prop": "errorMessage", "reason": "Es texto, no un caso: existe como `errorMessage` (opcional)." },
    { "prop": "helperText", "reason": "Es texto, no un caso: existe como `helperText` (opcional)." },
    { "prop": "action", "reason": "Es un nodo de React bajo el campo («¿Olvidaste tu contraseña?»); en nativo la app coloca su enlace bajo el campo, sin que el componente lo meta." },
    { "prop": "showPasswordLabel", "reason": "Es texto, no un caso: existe como `showPasswordLabel` con default «Mostrar contraseña»." },
    { "prop": "hidePasswordLabel", "reason": "Es texto, no un caso: existe como `hidePasswordLabel` con default «Ocultar contraseña»." },
    { "prop": "className", "reason": "Las clases CSS no existen en nativo; la personalización va por los tokens." }
  ],
  "differences": [
    "El botón de mostrar u ocultar (ojo / ojo tachado, los iconos del catálogo) va dentro de la caja, al final, como en la web; se nombra con `showPasswordLabel` o `hidePasswordLabel` según el estado y anuncia el estado pulsado (`aria-pressed` en la web, valor «activado» en VoiceOver y `ToggleableState` en TalkBack).",
    "Al mostrar o quitar la contraseña el campo conserva el foco (en SwiftUI no la posición del cursor: cambia de `SecureField` a `TextField`); la contraseña vuelve a oculta cuando el componente sale de pantalla (no se persiste el estado de visibilidad).",
    "Con la contraseña oculta el campo es seguro (`SecureField` en SwiftUI, `PasswordVisualTransformation` en Compose, sin copiar ni mostrar sugerencias) y pide el relleno automático de contraseña del sistema.",
    "Deshabilitado, el ojo se atenúa con el estilo del sistema (en SwiftUI); en React conserva su color.",
    "El foco se da desde fuera como en `InputField`: `ref` en React, `FocusState` (`.brandFocused`) en SwiftUI y `FocusRequester` en Compose.",
    "El resto de comportamiento (etiqueta, ayuda, error, tallas, tipo dinámico, zona táctil de 44 pt / 48 dp, claro y oscuro) es el de `InputField`: ver su ficha."
  ]
}
