{
  "$schema": "../schema.json",
  "component": "Text",
  "react": {
    "path": "src/stories/atoms/Text/Text.tsx",
    "props": "TextProps"
  },
  "native": {
    "swift": "BrandText",
    "kotlin": "BrandText"
  },
  "props": {
    "as": {
      "type": "union",
      "values": [
        "span",
        "em",
        "strong"
      ],
      "default": "span"
    },
    "tone": {
      "type": "union",
      "values": [
        "default",
        "muted",
        "destructive",
        "success"
      ],
      "default": "default"
    }
  },
  "excluded": [
    {
      "prop": "className",
      "reason": "Las clases CSS no existen en nativo; la personalización va por los tokens."
    },
    {
      "prop": "lang",
      "reason": "SwiftUI resuelve el idioma del fragmento desde el entorno (`.environment(\\.locale, …)`); no hay atributo por fragmento."
    },
    {
      "prop": "dir",
      "reason": "La dirección de escritura la decide el sistema según el idioma (`layoutDirection`); SwiftUI no la fija por fragmento."
    }
  ],
  "differences": [
    "`Text.brand(.strong)` necesita el tamaño del texto que lo rodea (`size:`, 16 pt por defecto) para cambiar el peso del eje `wght`: SwiftUI no lo cambia con `fontWeight(_:)` en una fuente variable de CoreText.",
    "El texto de la web se ve algo más grueso (suavizado de Chromium en macOS).",
    "En Kotlin la prop `as` se llama `element` (`as` es una palabra reservada) y el fragmento en línea se usa con `brandSpanStyle(element, tone)` dentro de un `AnnotatedString`; `BrandText` suelto hereda la tipografía del control o del párrafo en que va.",
    "En Compose `strong` no necesita el tamaño del texto que lo rodea: solo fija el peso (`SpanStyle`) y la fuente variable lo resuelve."
  ]
}
